{
  "charter": {
    "goals": [
      "Ship OAuth login for acme-app"
    ],
    "non_goals": [
      "Mobile native apps in v0.3"
    ]
  },
  "execution": {
    "handoff_at": "",
    "handoff_by": "",
    "interleave": "milestone",
    "mode": "planning",
    "strategy": "resume_then_ready"
  },
  "metrics": {
    "checked_at": "2026-06-17",
    "coverage_percent": 62,
    "integration_tests": 6,
    "lines_of_code": 4200,
    "unit_tests": 48
  },
  "project": {
    "created": "2026-06-17",
    "description": "Walkthrough fixture — OAuth milestone handoff-ready",
    "name": "acme-app",
    "planning_status": "ready-for-execution",
    "platforms": [
      "web"
    ],
    "stack": [
      "rust"
    ],
    "target_version": "v0.3.0"
  }
}
